{
  "$schema": "http://json-schema.org/draft-07/schema#",
  "title": "IsoBlock scene, format isoblock/1",
  "type": "object",
  "required": ["schema", "id", "units", "camera", "frame", "types", "objects"],
  "additionalProperties": false,
  "patternProperties": { "^x-": {} },
  "properties": {
    "schema": { "const": "isoblock/1" },
    "id": { "type": "string", "minLength": 1 },
    "units": {
      "type": "object",
      "required": ["name"],
      "additionalProperties": false,
      "patternProperties": { "^x-": {} },
      "properties": {
        "name": { "type": "string", "minLength": 1 },
        "note": { "type": "string" },
        "perMeter": { "type": ["number", "null"], "exclusiveMinimum": 0 }
      }
    },
    "camera": {
      "oneOf": [
        { "$ref": "#/definitions/axesCamera" },
        { "$ref": "#/definitions/viewCamera" }
      ]
    },
    "frame": {
      "type": "object",
      "required": ["w", "h", "regions"],
      "additionalProperties": false,
      "patternProperties": { "^x-": {} },
      "properties": {
        "w": { "type": "number", "exclusiveMinimum": 0 },
        "h": { "type": "number", "exclusiveMinimum": 0 },
        "regions": {
          "type": "array",
          "items": {
            "type": "object",
            "required": ["id", "rect"],
            "additionalProperties": false,
            "patternProperties": { "^x-": {} },
            "properties": {
              "id": { "type": "string", "minLength": 1 },
              "rect": { "type": "array", "items": { "type": "number" }, "minItems": 4, "maxItems": 4 },
              "blocksScene": { "type": "boolean" }
            }
          }
        }
      }
    },
    "strips": {
      "type": "array",
      "items": {
        "type": "object",
        "required": ["id", "v"],
        "additionalProperties": false,
        "patternProperties": { "^x-": {} },
        "properties": {
          "id": { "type": "string", "minLength": 1 },
          "v": { "type": "array", "items": { "type": ["number", "null"] }, "minItems": 2, "maxItems": 2 },
          "kind": { "type": "string" },
          "scale": { "type": "string" }
        }
      }
    },
    "types": {
      "type": "object",
      "propertyNames": { "minLength": 1 },
      "additionalProperties": {
        "type": "object",
        "required": ["size"],
        "additionalProperties": false,
        "patternProperties": { "^x-": {} },
        "properties": {
          "size": { "$ref": "#/definitions/size3" },
          "parts": {
            "type": "array",
            "items": {
              "type": "object",
              "required": ["id", "box"],
              "additionalProperties": false,
              "patternProperties": { "^x-": {} },
              "properties": {
                "id": { "type": "string", "minLength": 1 },
                "box": { "type": "array", "items": { "type": "number" }, "minItems": 6, "maxItems": 6 }
              }
            }
          },
          "anchors": {
            "type": "array",
            "items": {
              "type": "object",
              "required": ["id", "at"],
              "additionalProperties": false,
              "patternProperties": { "^x-": {} },
              "properties": {
                "id": { "type": "string", "minLength": 1 },
                "at": { "type": "array", "items": { "type": "number" }, "minItems": 3, "maxItems": 3 },
                "facing": { "type": "string" },
                "kind": { "type": "string" }
              }
            }
          },
          "genHint": { "type": "string" }
        }
      }
    },
    "objects": {
      "type": "array",
      "items": {
        "type": "object",
        "required": ["id", "type", "pos"],
        "additionalProperties": false,
        "patternProperties": { "^x-": {} },
        "properties": {
          "id": { "type": "string", "minLength": 1 },
          "type": { "type": "string", "minLength": 1 },
          "pos": { "oneOf": [{ "$ref": "#/definitions/vec2" }, { "$ref": "#/definitions/vec3" }] },
          "rot": { "enum": [0, 90, 180, 270], "default": 0 },
          "locks": {
            "type": "array",
            "items": {
              "anyOf": [
                { "enum": ["pos", "pos.u", "pos.v", "pos.h", "rot", "type"] },
                { "type": "string", "pattern": "^/" }
              ]
            }
          },
          "tags": { "type": "array", "items": { "type": "string" } }
        }
      }
    },
    "zones": {
      "type": "array",
      "items": {
        "type": "object",
        "required": ["id"],
        "additionalProperties": false,
        "patternProperties": { "^x-": {} },
        "properties": {
          "id": { "type": "string", "minLength": 1 },
          "kind": { "type": "string" },
          "points": { "type": "array", "items": { "$ref": "#/definitions/vec2" }, "minItems": 3 },
          "h": { "type": "number" }
        }
      }
    },
    "lanes": {
      "type": "array",
      "items": {
        "type": "object",
        "required": ["id", "width", "points"],
        "additionalProperties": false,
        "patternProperties": { "^x-": {} },
        "properties": {
          "id": { "type": "string", "minLength": 1 },
          "kind": { "type": "string" },
          "width": { "type": "number", "minimum": 0 },
          "dir": { "type": "string" },
          "h": { "type": "number" },
          "points": {
            "type": "array",
            "minItems": 2,
            "items": { "oneOf": [{ "$ref": "#/definitions/vec2" }, { "$ref": "#/definitions/vec3" }] }
          }
        }
      }
    },
    "relations": {
      "type": "array",
      "items": {
        "type": "object",
        "required": ["id", "rel"],
        "additionalProperties": false,
        "patternProperties": { "^x-": {} },
        "properties": {
          "id": { "type": "string", "minLength": 1 },
          "rel": {
            "enum": [
              "left_of", "right_of", "in_front_of", "behind", "against", "gap",
              "inside", "aligned", "facing", "on_lane", "clear_of", "order_along"
            ]
          },
          "a": { "type": "string", "minLength": 1 },
          "b": { "type": "string", "minLength": 1 },
          "ids": { "type": "array", "items": { "type": "string" }, "minItems": 1 },
          "gap": { "type": "array", "items": { "type": "number" }, "minItems": 2, "maxItems": 2 },
          "min": { "type": "number" },
          "axis": { "type": "string" },
          "t": { "type": "array", "items": { "type": "number" }, "minItems": 2, "maxItems": 2 },
          "hard": { "type": "boolean", "default": false },
          "weight": { "type": "number", "default": 1 },
          "source": { "type": "string" }
        },
        "if": { "properties": { "rel": { "const": "order_along" } } },
        "then": { "required": ["ids"] },
        "else": { "required": ["a"] }
      }
    },
    "checks": {
      "type": "array",
      "items": {
        "type": "object",
        "required": ["id", "check"],
        "properties": {
          "id": { "type": "string", "minLength": 1 },
          "check": {
            "enum": [
              "in_region", "no_overlap", "clearance", "lane_clear", "lane_reaches", "lane_apart", "reachable",
              "capacity", "visible", "min_screen_size", "sort_consistency", "visible_share", "state_stable"
            ]
          }
        },
        "oneOf": [
          { "$ref": "#/definitions/checkInRegion" },
          { "$ref": "#/definitions/checkNoOverlap" },
          { "$ref": "#/definitions/checkClearance" },
          { "$ref": "#/definitions/checkLaneClear" },
          { "$ref": "#/definitions/checkLaneReaches" },
          { "$ref": "#/definitions/checkLaneApart" },
          { "$ref": "#/definitions/checkVisible" },
          { "$ref": "#/definitions/checkReachable" },
          { "$ref": "#/definitions/checkCapacity" },
          { "$ref": "#/definitions/checkMinScreenSize" },
          { "$ref": "#/definitions/checkSortConsistency" },
          { "$ref": "#/definitions/checkVisibleShare" },
          { "$ref": "#/definitions/checkNotImplemented" }
        ],
        "discriminator": { "propertyName": "check" }
      }
    },
    "states": {
      "type": "object",
      "additionalProperties": {
        "type": "object",
        "additionalProperties": false,
        "patternProperties": { "^x-": {} },
        "properties": {
          "hide": { "type": "array", "items": { "type": "string" } },
          "hideParts": {
            "type": "object",
            "additionalProperties": { "type": "array", "items": { "type": "string", "minLength": 1 } }
          },
          "hideRegions": { "type": "array", "items": { "type": "string", "minLength": 1 } }
        }
      }
    },
    "assumptions": {
      "type": "array",
      "items": {
        "type": "object",
        "required": ["path", "value"],
        "additionalProperties": false,
        "patternProperties": { "^x-": {} },
        "properties": {
          "path": { "type": "string", "pattern": "^/" },
          "value": {},
          "note": { "type": "string" },
          "origin": { "type": "string" },
          "owner": { "type": "string" }
        }
      }
    },
    "meta": {
      "type": "object",
      "additionalProperties": false,
      "patternProperties": { "^x-": {} },
      "properties": {
        "version": { "type": "number" },
        "status": { "type": "string" },
        "approvedBy": { "type": ["string", "null"] },
        "approvedAt": { "type": ["string", "null"] }
      }
    }
  },
  "definitions": {
    "vec2": { "type": "array", "items": { "type": "number" }, "minItems": 2, "maxItems": 2 },
    "vec3": { "type": "array", "items": { "type": "number" }, "minItems": 3, "maxItems": 3 },
    "axesCamera": {
      "type": "object",
      "required": ["angleU", "angleV", "pxPerUnit", "origin"],
      "additionalProperties": false,
      "patternProperties": { "^x-": {} },
      "properties": {
        "angleU": { "type": "number" },
        "angleV": { "type": "number" },
        "pxPerUnit": { "type": "number", "exclusiveMinimum": 0 },
        "verticalScale": { "type": "number", "exclusiveMinimum": 0, "default": 1 },
        "origin": { "$ref": "#/definitions/vec2" }
      }
    },
    "viewCamera": {
      "type": "object",
      "required": ["elevation", "scale", "origin"],
      "additionalProperties": false,
      "patternProperties": { "^x-": {} },
      "properties": {
        "elevation": { "type": "number", "exclusiveMinimum": 0, "maximum": 90 },
        "direction": { "type": "number", "default": 45 },
        "scale": { "type": "number", "exclusiveMinimum": 0 },
        "origin": { "$ref": "#/definitions/vec2" }
      }
    },
    "size3": {
      "type": "array",
      "items": { "type": "number", "minimum": 0 },
      "minItems": 3,
      "maxItems": 3
    },
    "idList": { "type": "array", "items": { "type": "string" }, "minItems": 1 },
    "checkInRegion": {
      "type": "object",
      "required": ["id", "check", "region"],
      "additionalProperties": false,
      "patternProperties": { "^x-": {} },
      "properties": {
        "id": { "type": "string" },
        "check": { "const": "in_region" },
        "region": { "type": "string", "minLength": 1 },
        "strip": { "type": "string", "minLength": 1 },
        "ids": { "$ref": "#/definitions/idList" },
        "measure": { "enum": ["footprint", "drawn"], "default": "footprint" },
        "maxOutside": { "type": "number", "minimum": 0, "maximum": 1 }
      },
      "if": {
        "properties": { "measure": { "const": "drawn" } },
        "required": ["measure"]
      },
      "else": { "not": { "required": ["maxOutside"] } }
    },
    "checkNoOverlap": {
      "type": "object",
      "required": ["id", "check"],
      "additionalProperties": false,
      "patternProperties": { "^x-": {} },
      "properties": {
        "id": { "type": "string" },
        "check": { "const": "no_overlap" },
        "ids": { "$ref": "#/definitions/idList" },
        "allow": {
          "type": "array",
          "items": { "type": "array", "items": { "type": "string" }, "minItems": 2, "maxItems": 2 }
        }
      }
    },
    "checkClearance": {
      "type": "object",
      "required": ["id", "check", "a", "b", "min"],
      "additionalProperties": false,
      "patternProperties": { "^x-": {} },
      "properties": {
        "id": { "type": "string" },
        "check": { "const": "clearance" },
        "a": { "type": "string", "minLength": 1 },
        "b": { "type": "string", "minLength": 1 },
        "min": { "type": "number", "minimum": 0 },
        "warn": { "type": "number", "minimum": 0 }
      }
    },
    "checkLaneClear": {
      "type": "object",
      "required": ["id", "check", "lane"],
      "additionalProperties": false,
      "patternProperties": { "^x-": {} },
      "properties": {
        "id": { "type": "string" },
        "check": { "const": "lane_clear" },
        "lane": { "type": "string", "minLength": 1 },
        "ignore": { "type": "array", "items": { "type": "string" } },
        "height": { "type": "number" }
      }
    },
    "checkLaneReaches": {
      "type": "object",
      "required": ["id", "check", "lane", "edge", "region"],
      "additionalProperties": false,
      "patternProperties": { "^x-": {} },
      "properties": {
        "id": { "type": "string" },
        "check": { "const": "lane_reaches" },
        "lane": { "type": "string", "minLength": 1 },
        "edge": { "enum": ["right", "left", "top", "bottom"] },
        "region": { "type": "string", "minLength": 1 }
      }
    },
    "checkLaneApart": {
      "type": "object",
      "required": ["id", "check", "lane", "target"],
      "additionalProperties": false,
      "patternProperties": { "^x-": {} },
      "properties": {
        "id": { "type": "string" },
        "check": { "const": "lane_apart" },
        "lane": { "type": "string", "minLength": 1 },
        "target": { "type": "string", "pattern": "^(lane:.+|zone:.+)$" },
        "min": { "type": "number", "minimum": 0, "default": 0 },
        "warn": { "type": "number", "minimum": 0 }
      }
    },
    "checkVisible": {
      "type": "object",
      "required": ["id", "check", "target", "maxOccluded"],
      "additionalProperties": false,
      "patternProperties": { "^x-": {} },
      "properties": {
        "id": { "type": "string" },
        "check": { "const": "visible" },
        "target": { "type": "string", "minLength": 1 },
        "from": { "type": "number", "minimum": 0, "maximum": 1, "default": 0.55 },
        "maxOccluded": { "type": "number", "minimum": 0, "maximum": 1 },
        "warn": { "type": "number", "minimum": 0, "maximum": 1 }
      }
    },
    "pointRef": {
      "anyOf": [
        { "$ref": "#/definitions/vec2" },
        { "type": "string", "pattern": "^(lane:.+|anchor:.+/.+)$" }
      ]
    },
    "checkReachable": {
      "type": "object",
      "required": ["id", "check", "from", "to"],
      "additionalProperties": false,
      "patternProperties": { "^x-": {} },
      "properties": {
        "id": { "type": "string" },
        "check": { "const": "reachable" },
        "from": { "$ref": "#/definitions/pointRef" },
        "to": { "$ref": "#/definitions/pointRef" },
        "area": { "type": "string", "minLength": 1 },
        "radius": { "type": "number", "minimum": 0, "default": 0.2 },
        "step": { "type": "number", "exclusiveMinimum": 0, "default": 0.1 },
        "ignore": { "type": "array", "items": { "type": "string" } },
        "max": { "type": "number", "minimum": 0 },
        "level": { "type": "number" },
        "height": { "type": "number" },
        "warn": { "type": "number", "minimum": 0 }
      },
      "if": { "required": ["warn"] },
      "then": { "required": ["max"] }
    },
    "checkCapacity": {
      "type": "object",
      "required": ["id", "check", "kind", "min"],
      "additionalProperties": false,
      "patternProperties": { "^x-": {} },
      "properties": {
        "id": { "type": "string" },
        "check": { "const": "capacity" },
        "kind": { "type": "string", "minLength": 1 },
        "min": { "type": "number", "minimum": 0 },
        "warn": { "type": "number", "minimum": 0 },
        "body": {
          "type": "array",
          "items": { "type": "number", "minimum": 0 },
          "minItems": 2,
          "maxItems": 2,
          "default": [0.5, 0.5]
        },
        "ids": { "$ref": "#/definitions/idList" },
        "allow": { "type": "array", "items": { "type": "string" } }
      }
    },
    "checkMinScreenSize": {
      "type": "object",
      "required": ["id", "check", "target", "min"],
      "additionalProperties": false,
      "patternProperties": { "^x-": {} },
      "properties": {
        "id": { "type": "string" },
        "check": { "const": "min_screen_size" },
        "target": { "type": "string", "minLength": 1 },
        "min": { "type": "number", "minimum": 0 },
        "warn": { "type": "number", "minimum": 0 },
        "screenWidth": { "type": "number", "exclusiveMinimum": 0 },
        "measure": { "enum": ["bounds", "height"], "default": "bounds" }
      }
    },
    "checkSortConsistency": {
      "type": "object",
      "required": ["id", "check", "actor"],
      "additionalProperties": false,
      "patternProperties": { "^x-": {} },
      "properties": {
        "id": { "type": "string" },
        "check": { "const": "sort_consistency" },
        "actor": { "$ref": "#/definitions/size3" },
        "step": { "type": "number", "exclusiveMinimum": 0, "default": 0.1 },
        "reach": { "type": "number", "minimum": 0, "default": 1 },
        "maxPixels": { "type": "number", "minimum": 0, "default": 0 },
        "area": { "type": "string", "minLength": 1 },
        "ids": { "$ref": "#/definitions/idList" },
        "level": { "type": "number" }
      }
    },
    "checkVisibleShare": {
      "type": "object",
      "required": ["id", "check", "min"],
      "additionalProperties": false,
      "patternProperties": { "^x-": {} },
      "properties": {
        "id": { "type": "string" },
        "check": { "const": "visible_share" },
        "ids": { "$ref": "#/definitions/idList" },
        "tag": { "type": "string", "minLength": 1 },
        "region": { "type": "string", "minLength": 1 },
        "min": { "type": "number", "minimum": 0, "maximum": 1 },
        "warn": { "type": "number", "minimum": 0, "maximum": 1 }
      },
      "oneOf": [
        { "required": ["ids"], "not": { "required": ["tag"] } },
        { "required": ["tag"], "not": { "required": ["ids"] } }
      ]
    },
    "checkNotImplemented": {
      "type": "object",
      "required": ["id", "check"],
      "properties": {
        "id": { "type": "string" },
        "check": { "enum": ["state_stable"] }
      }
    }
  }
}
